{
  "schema": 1,
  "name": "Papier",
  "author": "KazemaRyukuro",
  "description": "Helle, ruhige Kapsel für helle Bildschirme, mit weicher Bewegung.",
  "colors": {
    "background": "#f5f5f7",
    "text": "#1d1d1f",
    "muted": "#6e6e73",
    "accent": "#0071e3",
    "onAccent": "#ffffff",
    "danger": "#d70015",
    "warning": "#b25000",
    "success": "#248a3d",
    "surface": "rgba(0, 0, 0, 0.06)",
    "surfaceHover": "rgba(0, 0, 0, 0.12)",
    "border": "rgba(0, 0, 0, 0.10)"
  },
  "island": { "idleWidth": 126, "idleHeight": 37, "expandedRadius": 36, "shadow": true },
  "motion": { "stiffness": 360, "damping": 30, "mass": 1 },
  "eye": { "glow": 0 }
}
